{
  "paper_id": "math_sum_evens",
  "schema_version": "0.1.0",
  "verification_boundary": "human_review_only",
  "metadata": {
    "provider": "eval_reference_fixture",
    "model": "n/a",
    "notes": "Regression anchor only; not from a live model run.",
    "reviewer_time_seconds": 42.0
  },
  "proposals": [
    {
      "claim": {
        "id": "math_sum_evens_claim_001",
        "paper_id": "math_sum_evens",
        "section": "1",
        "source_span": {
          "source_file": "source/source.pdf",
          "start": { "page": 1, "offset": 0 },
          "end": { "page": 1, "offset": 80 }
        },
        "informal_text": "The sum of two even natural numbers is even.",
        "claim_type": "theorem",
        "mathematical_density": "high",
        "status": "machine_checked",
        "value_kind": "foundational_law",
        "linked_symbols": [],
        "linked_assumptions": [],
        "linked_formal_targets": [
          "ScientificMemory.Mathematics.SumEvens.sum_evens"
        ]
      },
      "rationale": "Reference fixture aligned with corpus claim for eval recall.",
      "confidence": 1.0,
      "evidence_quote": "even"
    }
  ]
}
