{
  "paper_id": "math_sum_evens",
  "schema_version": "0.1.0",
  "verification_boundary": "human_review_only",
  "metadata": {
    "provider": "prime_intellect",
    "model": "fake",
    "model_version": null,
    "created_at": "2026-03-20T13:36:07Z",
    "latency_seconds": 0.0,
    "temperature": null,
    "top_p": null,
    "max_tokens": null,
    "seed": null,
    "prompt_template_id": null,
    "prompt_template_sha256": null,
    "input_artifact_sha256": null,
    "prompt_tokens": null,
    "completion_tokens": null,
    "total_tokens": null,
    "estimated_cost_usd": null,
    "reviewer_decision": null,
    "promotion_outcome": null,
    "notes": null
  },
  "proposals": []
}